{"applicability_conditions":["sanitized_fixture_only"],"edges":[{"branch_label":null,"condition_ref":null,"edge_id":"e03","join_key":null,"kind":"evidence_for","label":"evidence","max_iterations":null,"source_module":"experiment_and_evidence","source_port":null,"target_module":"evidence_validation","target_port":null},{"branch_label":"pass","condition_ref":"condition.e04","edge_id":"e04","join_key":null,"kind":"conditional","label":"pass","max_iterations":null,"source_module":"evidence_validation","source_port":null,"target_module":"closeout","target_port":null},{"branch_label":"fail","condition_ref":"condition.e05","edge_id":"e05","join_key":null,"kind":"fallback","label":"fail","max_iterations":null,"source_module":"evidence_validation","source_port":null,"target_module":"experiment_and_evidence","target_port":null}],"entry_module_ids":["experiment_and_evidence"],"exit_module_ids":["closeout"],"graph_id":"graph.diagnostics.researchloop_fallback","lineage":{"created_from_changeset":null,"parent_hashes":[],"source_adapter_id":"researchloop.paper_lifecycle","source_refs":["fixture://adapters/researchloop/e03-e05"],"source_revision":"sanitized-e03-e05.v1","supersedes_hashes":[]},"modules":[{"applicability_conditions":[],"content_refs":[],"contract_ref":"closeout.v1","control":null,"cost":"low","counterexamples":[],"deprecated":false,"description":"Return the fail-closed diagnostic result.","evidence_refs":[],"failure_modes":[],"fallback_refs":[],"inputs":[],"kind":"output","memory_refs":[],"module_id":"closeout","name":"Closeout","outputs":[],"permission_requirements":[],"postconditions":[],"preconditions":[],"prerequisites":[],"produced_evidence":[],"required_evidence":[],"reversibility":"clean","risk":"low","rule_refs":[],"schema":"mycevo.method_module.v1","side_effect_class":"none","side_effects":[],"version_id":"closeout.v1"},{"applicability_conditions":[],"content_refs":[],"contract_ref":"evidence_validation.v1","control":{"branch_labels":["fail","pass"],"kind":"condition","max_iterations":null},"cost":"low","counterexamples":[],"deprecated":false,"description":"Route passing evidence to closeout and failed evidence back to the experiment.","evidence_refs":[],"failure_modes":[],"fallback_refs":[],"inputs":[],"kind":"validation","memory_refs":[],"module_id":"evidence_validation","name":"Evidence validation","outputs":[],"permission_requirements":[],"postconditions":[],"preconditions":[],"prerequisites":[],"produced_evidence":[],"required_evidence":[],"reversibility":"clean","risk":"medium","rule_refs":[],"schema":"mycevo.method_module.v1","side_effect_class":"none","side_effects":[],"version_id":"evidence_validation.v1"},{"applicability_conditions":[],"content_refs":[],"contract_ref":"experiment_and_evidence.v1","control":null,"cost":"medium","counterexamples":[],"deprecated":false,"description":"Produce evidence for validation without an explicit bounded loop contract.","evidence_refs":[],"failure_modes":[],"fallback_refs":[],"inputs":[],"kind":"transform","memory_refs":[],"module_id":"experiment_and_evidence","name":"Experiment and evidence","outputs":[],"permission_requirements":[],"postconditions":[],"preconditions":[],"prerequisites":[],"produced_evidence":[],"required_evidence":[],"reversibility":"clean","risk":"medium","rule_refs":[],"schema":"mycevo.method_module.v1","side_effect_class":"none","side_effects":[],"version_id":"experiment_and_evidence.v1"}],"purpose":"A sanitized ResearchLoop-derived regression for the e03 evidence and e05 fallback cycle.","schema":"mycevo.method_graph.v1","task_contract_ref":"task.diagnostics.researchloop_fallback","version_id":"graph.diagnostics.researchloop_fallback.v1"}
