{"applicability_conditions":["sanitized_fixture_only"],"edges":[{"branch_label":null,"condition_ref":null,"edge_id":"e01","join_key":null,"kind":"sequence","label":"retry_path","max_iterations":null,"source_module":"capture","source_port":null,"target_module":"retry","target_port":null},{"branch_label":null,"condition_ref":null,"edge_id":"e02","join_key":null,"kind":"loop","label":"retry","max_iterations":2,"source_module":"retry","source_port":null,"target_module":"retry","target_port":null},{"branch_label":null,"condition_ref":null,"edge_id":"e03","join_key":null,"kind":"sequence","label":"write_path","max_iterations":null,"source_module":"capture","source_port":null,"target_module":"irreversible_write","target_port":null},{"branch_label":null,"condition_ref":null,"edge_id":"e04","join_key":null,"kind":"sequence","label":"next","max_iterations":null,"source_module":"irreversible_write","source_port":null,"target_module":"closeout","target_port":null}],"entry_module_ids":["capture"],"exit_module_ids":["closeout"],"graph_id":"graph.diagnostics.guard","lineage":{"created_from_changeset":null,"parent_hashes":[],"source_adapter_id":"diagnostic.fixture","source_refs":["fixture://diagnostics/guard"],"source_revision":"guard.v1","supersedes_hashes":[]},"modules":[{"applicability_conditions":[],"content_refs":[],"contract_ref":"capture.v1","control":null,"cost":"low","counterexamples":[],"deprecated":false,"description":"Capture sanitized input.","evidence_refs":[],"failure_modes":[],"fallback_refs":[],"inputs":[{"data_type":"task_request","multiple":false,"name":"task","required":true}],"kind":"input","memory_refs":[],"module_id":"capture","name":"Capture","outputs":[],"permission_requirements":[],"postconditions":[],"preconditions":[],"prerequisites":[],"produced_evidence":[],"required_evidence":[],"reversibility":"clean","risk":"low","rule_refs":[],"schema":"mycevo.method_module.v1","side_effect_class":"none","side_effects":[],"version_id":"capture.v1"},{"applicability_conditions":[],"content_refs":[],"contract_ref":"closeout.v1","control":null,"cost":"low","counterexamples":[],"deprecated":false,"description":"Return a result without the required gates.","evidence_refs":[],"failure_modes":[],"fallback_refs":[],"inputs":[],"kind":"output","memory_refs":[],"module_id":"closeout","name":"Closeout","outputs":[{"data_type":"closeout_record","multiple":false,"name":"result","required":true}],"permission_requirements":[],"postconditions":[],"preconditions":[],"prerequisites":["irreversible_write"],"produced_evidence":[],"required_evidence":[],"reversibility":"clean","risk":"low","rule_refs":[],"schema":"mycevo.method_module.v1","side_effect_class":"none","side_effects":[],"version_id":"closeout.v1"},{"applicability_conditions":[],"content_refs":[],"contract_ref":"irreversible_write.v1","control":null,"cost":"medium","counterexamples":[],"deprecated":false,"description":"Write a candidate artifact before any required validation or human gate.","evidence_refs":[],"failure_modes":[],"fallback_refs":[],"inputs":[],"kind":"transform","memory_refs":[],"module_id":"irreversible_write","name":"Irreversible write","outputs":[],"permission_requirements":["candidate_write"],"postconditions":[],"preconditions":[],"prerequisites":["capture"],"produced_evidence":[],"required_evidence":[],"reversibility":"review_required","risk":"high","rule_refs":[],"schema":"mycevo.method_module.v1","side_effect_class":"candidate_artifact_write","side_effects":["write_workspace"],"version_id":"irreversible_write.v1"},{"applicability_conditions":[],"content_refs":[],"contract_ref":"retry.v1","control":{"branch_labels":[],"kind":"loop","max_iterations":2},"cost":"low","counterexamples":[],"deprecated":false,"description":"A bounded loop that has no explicit exit edge.","evidence_refs":[],"failure_modes":["retry_exhausted"],"fallback_refs":[],"inputs":[],"kind":"transform","memory_refs":[],"module_id":"retry","name":"Retry","outputs":[],"permission_requirements":[],"postconditions":[],"preconditions":[],"prerequisites":["capture"],"produced_evidence":[],"required_evidence":[],"reversibility":"clean","risk":"medium","rule_refs":[],"schema":"mycevo.method_module.v1","side_effect_class":"none","side_effects":[],"version_id":"retry.v1"}],"purpose":"A legal graph missing required gates, lacking a loop exit, and crossing a side-effect boundary unsafely.","schema":"mycevo.method_graph.v1","task_contract_ref":"task.diagnostics.guard","version_id":"graph.diagnostics.guard.v1"}
