{"applicability_conditions":["sanitized_fixture_only"],"edges":[{"branch_label":null,"condition_ref":null,"edge_id":"e01","join_key":null,"kind":"data","label":"candidate","max_iterations":null,"source_module":"capture","source_port":"artifact","target_module":"validate","target_port":"artifact"},{"branch_label":null,"condition_ref":null,"edge_id":"e02","join_key":null,"kind":"data","label":"evaluation","max_iterations":null,"source_module":"validate","source_port":"evaluation","target_module":"human_gate","target_port":"evaluation"},{"branch_label":null,"condition_ref":null,"edge_id":"e03","join_key":null,"kind":"data","label":"decision","max_iterations":null,"source_module":"human_gate","source_port":"decision","target_module":"closeout","target_port":"decision"}],"entry_module_ids":["capture"],"exit_module_ids":["closeout"],"graph_id":"graph.diagnostics.valid","lineage":{"created_from_changeset":null,"parent_hashes":[],"source_adapter_id":"diagnostic.fixture","source_refs":["fixture://diagnostics/valid"],"source_revision":"valid.v1","supersedes_hashes":[]},"modules":[{"applicability_conditions":[],"content_refs":[],"contract_ref":"capture.v1","control":null,"cost":"low","counterexamples":[],"deprecated":false,"description":"Capture a sanitized task request.","evidence_refs":[],"failure_modes":[],"fallback_refs":[],"inputs":[{"data_type":"task_request","multiple":false,"name":"task","required":true}],"kind":"input","memory_refs":[],"module_id":"capture","name":"Capture","outputs":[{"data_type":"candidate_artifact","multiple":false,"name":"artifact","required":true}],"permission_requirements":[],"postconditions":["candidate_artifact_available"],"preconditions":[],"prerequisites":[],"produced_evidence":[{"evidence_type":"artifact_ref","minimum_count":1,"role":"candidate"}],"required_evidence":[],"reversibility":"clean","risk":"low","rule_refs":[],"schema":"mycevo.method_module.v1","side_effect_class":"none","side_effects":[],"version_id":"capture.v1"},{"applicability_conditions":[],"content_refs":[],"contract_ref":"closeout.v1","control":null,"cost":"low","counterexamples":[],"deprecated":false,"description":"Return the reviewed closeout record.","evidence_refs":["human_decision_ref"],"failure_modes":[],"fallback_refs":[],"inputs":[{"data_type":"human_decision","multiple":false,"name":"decision","required":true}],"kind":"output","memory_refs":[],"module_id":"closeout","name":"Closeout","outputs":[{"data_type":"closeout_record","multiple":false,"name":"result","required":true}],"permission_requirements":[],"postconditions":["closeout_record_available"],"preconditions":["human_decision_available"],"prerequisites":["human_gate"],"produced_evidence":[{"evidence_type":"closeout_ref","minimum_count":1,"role":"result"}],"required_evidence":[{"evidence_type":"human_decision_ref","minimum_count":1,"role":"approval"}],"reversibility":"clean","risk":"low","rule_refs":[],"schema":"mycevo.method_module.v1","side_effect_class":"none","side_effects":[],"version_id":"closeout.v1"},{"applicability_conditions":[],"content_refs":[],"contract_ref":"human_gate.v1","control":null,"cost":"low","counterexamples":["A passing evaluation is not human approval."],"deprecated":false,"description":"Record an authorized human decision without automatic promotion.","evidence_refs":["evaluation_result_ref"],"failure_modes":["actor_not_authorized"],"fallback_refs":[],"inputs":[{"data_type":"evaluation_result","multiple":false,"name":"evaluation","required":true}],"kind":"decision","memory_refs":[],"module_id":"human_gate","name":"Human gate","outputs":[{"data_type":"human_decision","multiple":false,"name":"decision","required":true}],"permission_requirements":["audit_append","authorized_human_decision"],"postconditions":["human_decision_available"],"preconditions":["evaluation_passed"],"prerequisites":["validate"],"produced_evidence":[{"evidence_type":"human_decision_ref","minimum_count":1,"role":"approval"}],"required_evidence":[{"evidence_type":"evaluation_result_ref","minimum_count":1,"role":"gate_input"}],"reversibility":"review_required","risk":"high","rule_refs":["human_approval_required"],"schema":"mycevo.method_module.v1","side_effect_class":"decision_record_append_only","side_effects":["human_interaction","write_workspace"],"version_id":"human_gate.v1"},{"applicability_conditions":[],"content_refs":[],"contract_ref":"validate.v1","control":null,"cost":"low","counterexamples":[],"deprecated":false,"description":"Validate candidate evidence without executing workflow nodes.","evidence_refs":["artifact_ref"],"failure_modes":["evidence_missing"],"fallback_refs":[],"inputs":[{"data_type":"candidate_artifact","multiple":false,"name":"artifact","required":true}],"kind":"validation","memory_refs":[],"module_id":"validate","name":"Validate","outputs":[{"data_type":"evaluation_result","multiple":false,"name":"evaluation","required":true}],"permission_requirements":[],"postconditions":["evaluation_passed"],"preconditions":["candidate_artifact_available"],"prerequisites":["capture"],"produced_evidence":[{"evidence_type":"evaluation_result_ref","minimum_count":1,"role":"gate_input"}],"required_evidence":[{"evidence_type":"artifact_ref","minimum_count":1,"role":"candidate"}],"reversibility":"clean","risk":"low","rule_refs":["evidence_gate_required"],"schema":"mycevo.method_module.v1","side_effect_class":"none","side_effects":[],"version_id":"validate.v1"}],"purpose":"A valid evidence-gated and human-controlled diagnostic baseline.","schema":"mycevo.method_graph.v1","task_contract_ref":"task.diagnostics.valid","version_id":"graph.diagnostics.valid.v1"}
