{"applicability_conditions":["sanitized_fixture_only"],"edges":[{"branch_label":"fail","condition_ref":"condition.fail","edge_id":"condition_fail","join_key":null,"kind":"condition_false","label":"fail","max_iterations":null,"source_module":"condition_router","source_port":null,"target_module":"fallback_router","target_port":null},{"branch_label":"pass","condition_ref":"condition.pass","edge_id":"condition_pass","join_key":null,"kind":"condition_true","label":"pass","max_iterations":null,"source_module":"condition_router","source_port":null,"target_module":"parallel_router","target_port":null},{"branch_label":"recover","condition_ref":"condition.recover","edge_id":"fallback_recover","join_key":null,"kind":"fallback","label":"recover","max_iterations":null,"source_module":"fallback_router","source_port":null,"target_module":"loop_runner","target_port":null},{"branch_label":null,"condition_ref":null,"edge_id":"loop_exit","join_key":null,"kind":"sequence","label":"exit","max_iterations":null,"source_module":"loop_runner","source_port":null,"target_module":"closeout","target_port":null},{"branch_label":null,"condition_ref":null,"edge_id":"loop_repeat","join_key":null,"kind":"loop","label":"repeat","max_iterations":2,"source_module":"loop_runner","source_port":null,"target_module":"loop_runner","target_port":null},{"branch_label":"left","condition_ref":null,"edge_id":"parallel_left","join_key":"joined","kind":"parallel","label":"left","max_iterations":null,"source_module":"parallel_router","source_port":null,"target_module":"parallel_join","target_port":null},{"branch_label":"right","condition_ref":null,"edge_id":"parallel_right","join_key":"joined","kind":"parallel","label":"right","max_iterations":null,"source_module":"parallel_router","source_port":null,"target_module":"parallel_join","target_port":null},{"branch_label":null,"condition_ref":null,"edge_id":"parallel_to_loop","join_key":null,"kind":"sequence","label":"next","max_iterations":null,"source_module":"parallel_join","source_port":null,"target_module":"loop_runner","target_port":null}],"entry_module_ids":["condition_router"],"exit_module_ids":["closeout"],"graph_id":"graph.diagnostics.clean_controls","lineage":{"created_from_changeset":null,"parent_hashes":[],"source_adapter_id":"diagnostic.fixture","source_refs":["fixture://diagnostics/clean-controls"],"source_revision":"clean-controls.v1","supersedes_hashes":[]},"modules":[{"applicability_conditions":[],"content_refs":[],"contract_ref":"closeout.v1","control":null,"cost":"low","counterexamples":[],"deprecated":false,"description":"Return the clean control result.","evidence_refs":[],"failure_modes":[],"fallback_refs":[],"inputs":[],"kind":"output","memory_refs":[],"module_id":"closeout","name":"Closeout","outputs":[],"permission_requirements":[],"postconditions":[],"preconditions":[],"prerequisites":[],"produced_evidence":[],"required_evidence":[],"reversibility":"clean","risk":"low","rule_refs":[],"schema":"mycevo.method_module.v1","side_effect_class":"none","side_effects":[],"version_id":"closeout.v1"},{"applicability_conditions":[],"content_refs":[],"contract_ref":"condition_router.v1","control":{"branch_labels":["fail","pass"],"kind":"condition","max_iterations":null},"cost":"low","counterexamples":[],"deprecated":false,"description":"Route explicit true and false outcomes.","evidence_refs":[],"failure_modes":[],"fallback_refs":[],"inputs":[],"kind":"decision","memory_refs":[],"module_id":"condition_router","name":"Condition router","outputs":[],"permission_requirements":[],"postconditions":[],"preconditions":[],"prerequisites":[],"produced_evidence":[],"required_evidence":[],"reversibility":"clean","risk":"low","rule_refs":[],"schema":"mycevo.method_module.v1","side_effect_class":"none","side_effects":[],"version_id":"condition_router.v1"},{"applicability_conditions":[],"content_refs":[],"contract_ref":"fallback_router.v1","control":{"branch_labels":["recover"],"kind":"fallback","max_iterations":null},"cost":"low","counterexamples":[],"deprecated":false,"description":"Route one explicit fallback outcome.","evidence_refs":[],"failure_modes":[],"fallback_refs":[],"inputs":[],"kind":"transform","memory_refs":[],"module_id":"fallback_router","name":"Fallback router","outputs":[],"permission_requirements":[],"postconditions":[],"preconditions":[],"prerequisites":[],"produced_evidence":[],"required_evidence":[],"reversibility":"clean","risk":"low","rule_refs":[],"schema":"mycevo.method_module.v1","side_effect_class":"none","side_effects":[],"version_id":"fallback_router.v1"},{"applicability_conditions":[],"content_refs":[],"contract_ref":"loop_runner.v1","control":{"branch_labels":[],"kind":"loop","max_iterations":2},"cost":"low","counterexamples":[],"deprecated":false,"description":"Run a bounded loop with an explicit sequence exit.","evidence_refs":[],"failure_modes":[],"fallback_refs":[],"inputs":[],"kind":"transform","memory_refs":[],"module_id":"loop_runner","name":"Loop runner","outputs":[],"permission_requirements":[],"postconditions":[],"preconditions":[],"prerequisites":[],"produced_evidence":[],"required_evidence":[],"reversibility":"clean","risk":"low","rule_refs":[],"schema":"mycevo.method_module.v1","side_effect_class":"none","side_effects":[],"version_id":"loop_runner.v1"},{"applicability_conditions":[],"content_refs":[],"contract_ref":"parallel_join.v1","control":null,"cost":"low","counterexamples":[],"deprecated":false,"description":"Join both parallel branch contracts.","evidence_refs":[],"failure_modes":[],"fallback_refs":[],"inputs":[],"kind":"transform","memory_refs":[],"module_id":"parallel_join","name":"Parallel join","outputs":[],"permission_requirements":[],"postconditions":[],"preconditions":[],"prerequisites":[],"produced_evidence":[],"required_evidence":[],"reversibility":"clean","risk":"low","rule_refs":[],"schema":"mycevo.method_module.v1","side_effect_class":"none","side_effects":[],"version_id":"parallel_join.v1"},{"applicability_conditions":[],"content_refs":[],"contract_ref":"parallel_router.v1","control":{"branch_labels":["left","right"],"kind":"parallel","max_iterations":null},"cost":"low","counterexamples":[],"deprecated":false,"description":"Declare two branches with one explicit join target and join key.","evidence_refs":[],"failure_modes":[],"fallback_refs":[],"inputs":[],"kind":"transform","memory_refs":[],"module_id":"parallel_router","name":"Parallel router","outputs":[],"permission_requirements":[],"postconditions":[],"preconditions":[],"prerequisites":[],"produced_evidence":[],"required_evidence":[],"reversibility":"clean","risk":"low","rule_refs":[],"schema":"mycevo.method_module.v1","side_effect_class":"none","side_effects":[],"version_id":"parallel_router.v1"}],"purpose":"A clean graph covering condition, parallel, bounded loop, and fallback control forms.","schema":"mycevo.method_graph.v1","task_contract_ref":"task.diagnostics.clean_controls","version_id":"graph.diagnostics.clean_controls.v1"}
