{"applicability_conditions":[],"edges":[{"branch_label":null,"condition_ref":null,"edge_id":"alpha_beta","join_key":null,"kind":"sequence","label":null,"max_iterations":null,"source_module":"alpha","source_port":null,"target_module":"beta","target_port":null},{"branch_label":null,"condition_ref":null,"edge_id":"beta_gamma","join_key":null,"kind":"sequence","label":null,"max_iterations":null,"source_module":"beta","source_port":null,"target_module":"gamma","target_port":null},{"branch_label":null,"condition_ref":null,"edge_id":"gamma_sink","join_key":null,"kind":"sequence","label":null,"max_iterations":null,"source_module":"gamma","source_port":null,"target_module":"sink","target_port":null},{"branch_label":null,"condition_ref":null,"edge_id":"input_alpha","join_key":null,"kind":"sequence","label":null,"max_iterations":null,"source_module":"input","source_port":null,"target_module":"alpha","target_port":null}],"entry_module_ids":["input"],"exit_module_ids":["sink"],"graph_id":"graph.changeset.golden","lineage":{"created_from_changeset":null,"parent_hashes":[],"source_adapter_id":null,"source_refs":["fixture:changesets"],"source_revision":null,"supersedes_hashes":[]},"modules":[{"applicability_conditions":[],"content_refs":[],"contract_ref":null,"control":null,"cost":"low","counterexamples":[],"deprecated":false,"description":"Golden module alpha.","evidence_refs":[],"failure_modes":[],"fallback_refs":[],"inputs":[],"kind":"transform","memory_refs":[],"module_id":"alpha","name":"Alpha","outputs":[],"permission_requirements":[],"postconditions":[],"preconditions":[],"prerequisites":[],"produced_evidence":[],"required_evidence":[],"reversibility":"clean","risk":"low","rule_refs":[],"schema":"mycevo.method_module.v1","side_effect_class":"none","side_effects":[],"version_id":"alpha.v1"},{"applicability_conditions":[],"content_refs":[],"contract_ref":null,"control":null,"cost":"low","counterexamples":[],"deprecated":false,"description":"Golden module beta.","evidence_refs":[],"failure_modes":[],"fallback_refs":[],"inputs":[],"kind":"transform","memory_refs":[],"module_id":"beta","name":"Beta","outputs":[],"permission_requirements":[],"postconditions":[],"preconditions":[],"prerequisites":[],"produced_evidence":[],"required_evidence":[],"reversibility":"clean","risk":"low","rule_refs":[],"schema":"mycevo.method_module.v1","side_effect_class":"none","side_effects":[],"version_id":"beta.v1"},{"applicability_conditions":[],"content_refs":[],"contract_ref":null,"control":null,"cost":"low","counterexamples":[],"deprecated":false,"description":"Golden module gamma.","evidence_refs":[],"failure_modes":[],"fallback_refs":[],"inputs":[],"kind":"transform","memory_refs":[],"module_id":"gamma","name":"Gamma","outputs":[],"permission_requirements":[],"postconditions":[],"preconditions":[],"prerequisites":[],"produced_evidence":[],"required_evidence":[],"reversibility":"clean","risk":"low","rule_refs":[],"schema":"mycevo.method_module.v1","side_effect_class":"none","side_effects":[],"version_id":"gamma.v1"},{"applicability_conditions":[],"content_refs":[],"contract_ref":null,"control":null,"cost":"low","counterexamples":[],"deprecated":false,"description":"Golden module input.","evidence_refs":[],"failure_modes":[],"fallback_refs":[],"inputs":[],"kind":"input","memory_refs":[],"module_id":"input","name":"Input","outputs":[],"permission_requirements":[],"postconditions":[],"preconditions":[],"prerequisites":[],"produced_evidence":[],"required_evidence":[],"reversibility":"clean","risk":"low","rule_refs":[],"schema":"mycevo.method_module.v1","side_effect_class":"none","side_effects":[],"version_id":"input.v1"},{"applicability_conditions":[],"content_refs":[],"contract_ref":null,"control":null,"cost":"low","counterexamples":[],"deprecated":false,"description":"Golden module sink.","evidence_refs":[],"failure_modes":[],"fallback_refs":[],"inputs":[],"kind":"output","memory_refs":[],"module_id":"sink","name":"Sink","outputs":[],"permission_requirements":[],"postconditions":[],"preconditions":[],"prerequisites":[],"produced_evidence":[],"required_evidence":[],"reversibility":"clean","risk":"low","rule_refs":[],"schema":"mycevo.method_module.v1","side_effect_class":"none","side_effects":[],"version_id":"sink.v1"}],"purpose":"Exercise deterministic Phase 3 graph transformations.","schema":"mycevo.method_graph.v1","task_contract_ref":null,"version_id":"graph.changeset.golden.v1"}
