{"applicability_conditions":["sanitized_fixture_only"],"edges":[{"branch_label":null,"condition_ref":null,"edge_id":"e01","join_key":null,"kind":"sequence","label":"next","max_iterations":null,"source_module":"capture","source_port":null,"target_module":"prepare","target_port":null},{"branch_label":null,"condition_ref":null,"edge_id":"e02","join_key":null,"kind":"sequence","label":"next","max_iterations":null,"source_module":"prepare","source_port":null,"target_module":"evaluate","target_port":null},{"branch_label":null,"condition_ref":null,"edge_id":"e03","join_key":null,"kind":"sequence","label":"next","max_iterations":null,"source_module":"evaluate","source_port":null,"target_module":"closeout","target_port":null}],"entry_module_ids":["capture"],"exit_module_ids":["closeout"],"graph_id":"graph.diagnostics.order","lineage":{"created_from_changeset":null,"parent_hashes":[],"source_adapter_id":"diagnostic.fixture","source_refs":["fixture://diagnostics/order"],"source_revision":"order.v1","supersedes_hashes":[]},"modules":[{"applicability_conditions":[],"content_refs":[],"contract_ref":"capture.v1","control":null,"cost":"low","counterexamples":[],"deprecated":false,"description":"Capture sanitized input.","evidence_refs":[],"failure_modes":[],"fallback_refs":[],"inputs":[{"data_type":"task_request","multiple":false,"name":"task","required":true}],"kind":"input","memory_refs":[],"module_id":"capture","name":"Capture","outputs":[],"permission_requirements":[],"postconditions":[],"preconditions":[],"prerequisites":[],"produced_evidence":[],"required_evidence":[],"reversibility":"clean","risk":"low","rule_refs":[],"schema":"mycevo.method_module.v1","side_effect_class":"none","side_effects":[],"version_id":"capture.v1"},{"applicability_conditions":[],"content_refs":[],"contract_ref":"closeout.v1","control":null,"cost":"low","counterexamples":[],"deprecated":false,"description":"Return the result.","evidence_refs":[],"failure_modes":[],"fallback_refs":[],"inputs":[],"kind":"output","memory_refs":[],"module_id":"closeout","name":"Closeout","outputs":[{"data_type":"closeout_record","multiple":false,"name":"result","required":true}],"permission_requirements":[],"postconditions":[],"preconditions":[],"prerequisites":["evaluate"],"produced_evidence":[],"required_evidence":[],"reversibility":"clean","risk":"low","rule_refs":[],"schema":"mycevo.method_module.v1","side_effect_class":"none","side_effects":[],"version_id":"closeout.v1"},{"applicability_conditions":[],"content_refs":[],"contract_ref":"evaluate.v1","control":null,"cost":"low","counterexamples":[],"deprecated":false,"description":"Evaluate after prepare while also participating in a deliberate prerequisite cycle.","evidence_refs":[],"failure_modes":[],"fallback_refs":[],"inputs":[],"kind":"validation","memory_refs":[],"module_id":"evaluate","name":"Evaluate","outputs":[],"permission_requirements":[],"postconditions":[],"preconditions":[],"prerequisites":["prepare"],"produced_evidence":[],"required_evidence":[],"reversibility":"clean","risk":"low","rule_refs":[],"schema":"mycevo.method_module.v1","side_effect_class":"none","side_effects":[],"version_id":"evaluate.v1"},{"applicability_conditions":[],"content_refs":[],"contract_ref":"prepare.v1","control":null,"cost":"low","counterexamples":[],"deprecated":false,"description":"Prepare before evaluate while incorrectly requiring evaluate first.","evidence_refs":[],"failure_modes":[],"fallback_refs":[],"inputs":[],"kind":"transform","memory_refs":[],"module_id":"prepare","name":"Prepare","outputs":[],"permission_requirements":[],"postconditions":[],"preconditions":[],"prerequisites":["evaluate"],"produced_evidence":[],"required_evidence":[],"reversibility":"clean","risk":"low","rule_refs":[],"schema":"mycevo.method_module.v1","side_effect_class":"none","side_effects":[],"version_id":"prepare.v1"}],"purpose":"A legal graph with a prerequisite cycle and contradictory sequence order.","schema":"mycevo.method_graph.v1","task_contract_ref":"task.diagnostics.order","version_id":"graph.diagnostics.order.v1"}
