{"applicability_conditions":["sanitized_fixture_only"],"edges":[{"branch_label":null,"condition_ref":null,"edge_id":"e01","join_key":null,"kind":"sequence","label":"next","max_iterations":null,"source_module":"capture","source_port":null,"target_module":"legacy_transform","target_port":null},{"branch_label":null,"condition_ref":null,"edge_id":"e02","join_key":null,"kind":"sequence","label":"next","max_iterations":null,"source_module":"legacy_transform","source_port":null,"target_module":"closeout","target_port":null}],"entry_module_ids":["capture"],"exit_module_ids":["closeout"],"graph_id":"graph.diagnostics.structural","lineage":{"created_from_changeset":null,"parent_hashes":[],"source_adapter_id":"diagnostic.fixture","source_refs":["fixture://diagnostics/structural"],"source_revision":"structural.v1","supersedes_hashes":[]},"modules":[{"applicability_conditions":[],"content_refs":[],"contract_ref":"capture.v1","control":null,"cost":"low","counterexamples":[],"deprecated":false,"description":"Capture sanitized input.","evidence_refs":[],"failure_modes":[],"fallback_refs":[],"inputs":[{"data_type":"task_request","multiple":false,"name":"task","required":true}],"kind":"input","memory_refs":[],"module_id":"capture","name":"Capture","outputs":[],"permission_requirements":[],"postconditions":[],"preconditions":[],"prerequisites":[],"produced_evidence":[],"required_evidence":[],"reversibility":"clean","risk":"low","rule_refs":[],"schema":"mycevo.method_module.v1","side_effect_class":"none","side_effects":[],"version_id":"capture.v1"},{"applicability_conditions":[],"content_refs":[],"contract_ref":"closeout.v1","control":null,"cost":"low","counterexamples":[],"deprecated":false,"description":"Return a sanitized result.","evidence_refs":[],"failure_modes":[],"fallback_refs":[],"inputs":[],"kind":"output","memory_refs":[],"module_id":"closeout","name":"Closeout","outputs":[{"data_type":"closeout_record","multiple":false,"name":"result","required":true}],"permission_requirements":[],"postconditions":[],"preconditions":[],"prerequisites":["legacy_transform"],"produced_evidence":[],"required_evidence":[],"reversibility":"clean","risk":"low","rule_refs":[],"schema":"mycevo.method_module.v1","side_effect_class":"none","side_effects":[],"version_id":"closeout.v1"},{"applicability_conditions":[],"content_refs":[],"contract_ref":"legacy_transform.v1","control":null,"cost":"low","counterexamples":[],"deprecated":true,"description":"A referenced deprecated module with a stale external rule reference.","evidence_refs":[],"failure_modes":[],"fallback_refs":[],"inputs":[],"kind":"transform","memory_refs":[],"module_id":"legacy_transform","name":"Legacy transform","outputs":[],"permission_requirements":[],"postconditions":[],"preconditions":[],"prerequisites":["capture"],"produced_evidence":[],"required_evidence":[],"reversibility":"clean","risk":"medium","rule_refs":["rule.missing"],"schema":"mycevo.method_module.v1","side_effect_class":"none","side_effects":[],"version_id":"legacy_transform.v1"},{"applicability_conditions":[],"content_refs":[],"contract_ref":"orphan_transform.v1","control":null,"cost":"low","counterexamples":[],"deprecated":false,"description":"A legal module with no path from an entry module.","evidence_refs":[],"failure_modes":[],"fallback_refs":[],"inputs":[],"kind":"transform","memory_refs":[],"module_id":"orphan_transform","name":"Orphan transform","outputs":[],"permission_requirements":[],"postconditions":[],"preconditions":[],"prerequisites":[],"produced_evidence":[],"required_evidence":[],"reversibility":"clean","risk":"low","rule_refs":[],"schema":"mycevo.method_module.v1","side_effect_class":"none","side_effects":[],"version_id":"orphan_transform.v1"}],"purpose":"A legal graph containing unreachable, deprecated, and stale-reference diagnostic targets.","schema":"mycevo.method_graph.v1","task_contract_ref":"task.diagnostics.structural","version_id":"graph.diagnostics.structural.v1"}
